{"classification":"SYNTHETIC","id":"housing-scenario","kind":"scenario","label":"DEMO / SYNTHETIC DATA","model_pack_id":"housing-model","provenance":{"as_of":"2026-10-01","dataset_sha256":"056f0d8331eeb8a3751c03063740f248a4942c7a21fc54e10b4b77fce27bf2ed","generated_at":"2026-10-09T18:00:00Z","limitations":["Datos inventados exclusivamente para demostración.","Sin reposiciones, anulaciones intermedias ni cambios de universo."],"semantics":"SYNTHETIC_DEMO","source":"Authored deterministic fixture housing-v1","transformation":"Meses completos; cohorte fija; media móvil de tres meses limitada por stock."},"scenarios":[{"explanation":"Ritmo multiplicado por 0.75; acotado por inventario. Supuesto, no probabilidad.","id":"DEMO-A-slow","model_pack_id":"housing-model","multiplier":0.75,"prediction":2.5,"project":"DEMO-A"},{"explanation":"Ritmo multiplicado por 1.0; acotado por inventario. Supuesto, no probabilidad.","id":"DEMO-A-base","model_pack_id":"housing-model","multiplier":1.0,"prediction":3.3333333333333335,"project":"DEMO-A"},{"explanation":"Ritmo multiplicado por 1.25; acotado por inventario. Supuesto, no probabilidad.","id":"DEMO-A-fast","model_pack_id":"housing-model","multiplier":1.25,"prediction":4.166666666666667,"project":"DEMO-A"},{"explanation":"Ritmo multiplicado por 0.75; acotado por inventario. Supuesto, no probabilidad.","id":"DEMO-B-slow","model_pack_id":"housing-model","multiplier":0.75,"prediction":5.75,"project":"DEMO-B"},{"explanation":"Ritmo multiplicado por 1.0; acotado por inventario. Supuesto, no probabilidad.","id":"DEMO-B-base","model_pack_id":"housing-model","multiplier":1.0,"prediction":7.666666666666667,"project":"DEMO-B"},{"explanation":"Ritmo multiplicado por 1.25; acotado por inventario. Supuesto, no probabilidad.","id":"DEMO-B-fast","model_pack_id":"housing-model","multiplier":1.25,"prediction":9.583333333333334,"project":"DEMO-B"}],"schema_version":"1.0.0","version":"1.0.0"}
